source,theme,titre,date,date_parsed,auteur,contenu,url
SeneNews,Politique,Poste de SG de l’ONU : Les vérités de Alioune Tine dans l’affaire Macky Sall,15/06/2025 à 16:00,2025-06-15 16:00,Modou Mamoune Tine,"Invité de l’émission Le Jury du Dimanche ce 15 juin 2025 sur iRadio, Alioune Tine, défenseur des droits humains et ancien président du Comité sénégalais des droits de l’homme, s’est exprimé avec prudence sur les rumeurs autour d’une éventuelle candidature de l’ex-président Macky Sall au poste de Secrétaire général des Nations Unies.

Évoquant la possibilité pour un ancien président sénégalais d’occuper une fonction internationale,Alioune Tinea rappelé le précédent d’Abdou Diouf, porté à la tête de l’Organisation internationale de la Francophonie avec l’accord tardif du président Abdoulaye Wade. Il a estimé qu’en diplomatie, les positions évoluent et qu’un consensus peut toujours être trouvé. Face aux critiques virulentes, notamment celles d’Aminata Touré et de certains diplomates, il a défendu le principe du respect dû à tout ancien chef d’État. « Quelle que soit l’appréciation de son action, il faut toujours se rappeler du statut », a-t-il insisté, appelant à des échanges responsables et dignes des valeurs démocratiques du Sénégal.",https://www.senenews.com/actualites/poste-de-sg-de-lonu-les-verites-de-alioune-tine-dans-laffaire-macky-sall_545968.html
SeneNews,Actualité,"Accident sur l’axe Kébémer-Dakar : Un « Ndiaga Ndiaye » se renverse, 24 blessés dont 3 graves",15/06/2025 à 15:39,2025-06-15 15:39,Barry Souleymane,"Un accident de la route s’est produit ce dimanche 15 juin 2025, aux environs de 10 heures, sur la route reliant Kébémer à Dakar, précisément à hauteur du village de Mbaka Lo.",https://www.senenews.com/actualites/accident-sur-laxe-kebemer-dakar-un-ndiaga-ndiaye-se-renverse-24-blesses-dont-3-graves_545967.html
SeneNews,International,Israël-Iran : Bilan humain lourd des deux côtés après les frappes croisées,15/06/2025 à 14:43,2025-06-15 14:43,Barry Souleymane,"En représailles, l’État hébreu a mené des frappes ciblées sur plusieurs sites en Iran, notamment dans la capitale Téhéran. Le ministère iranien de la Santé a fait état de 120 morts et de plus de 900 blessés dans ces attaques.Les bilans restent provisoires alors que les opérations de secours et les évaluations des dégâts se poursuivent dans les deux pays.

Les bilans restent provisoires alors que les opérations de secours et les évaluations des dégâts se poursuivent dans les deux pays.",https://www.senenews.com/actualites/politique/israel-iran-bilan-humain-lourd-des-deux-cotes-apres-les-frappes-croisees_545966.html
SeneNews,Actualité,Alioune Tine critique l’incarcération de Moustapha Diakhaté et plaide pour une réforme de la justice pénale,15/06/2025 à 13:53,2025-06-15 13:53,Barry Souleymane,"Invité de l’émission Le Jury du Dimanche sur iRadio, Alioune Tine, fondateur du think tank Afrikajom Center, s’est exprimé sur l’actualité judiciaire et institutionnelle du Sénégal, notamment le placement sous mandat de dépôt de l’ancien député Moustapha Diakhaté et le rôle de la Haute Cour de justice.",https://www.senenews.com/actualites/alioune-tine-critique-lincarceration-de-moustapha-diakhate-et-plaide-pour-une-reforme-de-la-justice-penale_545964.html
SeneNews,Actualité,Mbour : un adolescent de 16 ans tué par arme blanche lors d’un match de football,15/06/2025 à 13:24,2025-06-15 13:24,Barry Souleymane,"Un élève coranique âgé de 16 ans, Mouhamed Ndiaye, a été mortellement poignardé ce samedi 15 juin 2025 dans le quartier Espagne àMbour. Le drame s’est produit aux environs de 18h45, à la suite d’une altercation avec un autre jeune, Iba Niang, âgé de 14 ans, lors d’un match de football de quartier.",https://www.senenews.com/actualites/mbour-un-adolescent-de-16-ans-tue-par-arme-blanche-lors-dun-match-de-football_545963.html
SeneNews,Actualité,"Ranérou : un conducteur de moto perd la vie, un second accident fait 7 blessés",15/06/2025 à 12:12,2025-06-15 12:12,Barry Souleymane,"La route nationale n°3 (RN3) a été le théâtre de deuxaccidentstragiques ce mardi matin dans le département de Matam, plus précisément à hauteur de Dendoudi, dans la commune de Ogo.

À peine une heure et demie plus tard, vers 11h30, un second accident est survenu sur le même axe, à environ 2 kilomètres du poste de douane de Ranérou. Un véhicule de marque Peugeot 406, immatriculé AA 115 QL, qui assurait la liaison entre Ourossogui et Touba, s’est renversé pour des raisons encore non précisées.Le bilan fait état de sept blessés, dont deux dans un état grave. Ces derniers ont été évacués d’urgence vers le district sanitaire de Ranérou pour une prise en charge médicale.

Le bilan fait état de sept blessés, dont deux dans un état grave. Ces derniers ont été évacués d’urgence vers le district sanitaire de Ranérou pour une prise en charge médicale.",https://www.senenews.com/actualites/ranerou-un-conducteur-de-moto-perd-la-vie-un-second-accident-fait-7-blesses_545962.html
SeneNews,Actualité,"Troisième jour de conflit : Israël riposte aux frappes iraniennes, le bilan s’alourdit",15/06/2025 à 12:02,2025-06-15 12:02,Barry Souleymane,"À Bat Yam, dans la région de Tel-Aviv, six personnes ont péri, dont deux femmes âgées (69 et 80 ans), un garçon de 10 ans et une fillette de 8 ans, selon les secours du Magen David Adom (MDA). L’attaque a également fait 99 blessés, dont quatre grièvement atteints. La police israélienne a confirmé sur place la mort de deux autres personnes lors de cette même frappe.Les opérations de recherche se poursuivent, car sept personnes sont encore portées disparues, selon Daniel Hadad, commandant de la police.Plus au nord, à Tamra, dans la région de la Galilée, un immeuble de trois étages s’est effondré après un tir iranien. Le MDA y a recensé la mort de trois femmes. L’hôpital Rambam de Haïfa a ensuite confirmé un quatrième décès : une femme grièvement blessée y a succombé. Parmi les victimes de cette frappe figure une jeune adolescente de 13 ans, selon le bureau du Premier ministre.Dégâts à RehovotDans la région de Shfelah, à l’ouest de Jérusalem, notamment autour de Rehovot, au moins 37 personnes ont été blessées, dont deux grièvement, toujours d’après le MDA. Un homme a été extrait vivant des décombres d’un immeuble effondré, ce qui laisse craindre un bilan encore évolutif.

Les opérations de recherche se poursuivent, car sept personnes sont encore portées disparues, selon Daniel Hadad, commandant de la police.Plus au nord, à Tamra, dans la région de la Galilée, un immeuble de trois étages s’est effondré après un tir iranien. Le MDA y a recensé la mort de trois femmes. L’hôpital Rambam de Haïfa a ensuite confirmé un quatrième décès : une femme grièvement blessée y a succombé. Parmi les victimes de cette frappe figure une jeune adolescente de 13 ans, selon le bureau du Premier ministre.Dégâts à RehovotDans la région de Shfelah, à l’ouest de Jérusalem, notamment autour de Rehovot, au moins 37 personnes ont été blessées, dont deux grièvement, toujours d’après le MDA. Un homme a été extrait vivant des décombres d’un immeuble effondré, ce qui laisse craindre un bilan encore évolutif.

Plus au nord, à Tamra, dans la région de la Galilée, un immeuble de trois étages s’est effondré après un tir iranien. Le MDA y a recensé la mort de trois femmes. L’hôpital Rambam de Haïfa a ensuite confirmé un quatrième décès : une femme grièvement blessée y a succombé. Parmi les victimes de cette frappe figure une jeune adolescente de 13 ans, selon le bureau du Premier ministre.Dégâts à RehovotDans la région de Shfelah, à l’ouest de Jérusalem, notamment autour de Rehovot, au moins 37 personnes ont été blessées, dont deux grièvement, toujours d’après le MDA. Un homme a été extrait vivant des décombres d’un immeuble effondré, ce qui laisse craindre un bilan encore évolutif.

Dans la région de Shfelah, à l’ouest de Jérusalem, notamment autour de Rehovot, au moins 37 personnes ont été blessées, dont deux grièvement, toujours d’après le MDA. Un homme a été extrait vivant des décombres d’un immeuble effondré, ce qui laisse craindre un bilan encore évolutif.",https://www.senenews.com/actualites/troisieme-jour-de-conflit-israel-riposte-aux-frappes-iraniennes-le-bilan-salourdit_545959.html
SeneNews,International,"Israël-Iran : des frappes meurtrières font des dizaines de victimes, les tensions atteignent un niveau critique",15/06/2025 à 10:39,2025-06-15 10:39,Barry Souleymane,"Le conflit entre Israël et l’Iran connaît une nouvelle escalade dramatique. Depuis samedi soir, une série de frappes et de tirs de missiles a fait au moins 13 morts et plus de 200 blessés dans les deux pays. La situation s’aggrave d’heure en heure, avec des pertes civiles croissantes et des infrastructures stratégiques visées.",https://www.senenews.com/actualites/politique/israel-iran-des-frappes-meurtrieres-font-des-dizaines-de-victimes-les-tensions-atteignent-un-niveau-critique_545956.html
SeneNews,Actualité,Dernière minute – Validation des médias par l’État du Sénégal : La justice donne raison à Aissatou Diop Fall,12/06/2025 à 16:31,2025-06-12 16:31,Khadija Sène,"L’affaire a également révélé la fragilité économique du secteur médiatique sénégalais, avec de nombreuses entreprises en « situation de quasi-faillite ». Les arrêtés de cessation ont eu des « conséquences dramatiques » pour les entreprises de presse.Vers un dialogue renouveléMalgré cette victoire, les tensions persistent. Le CDEPS appelle à un « dialogue rénové » avec la presse sénégalaise, soulignant l’importance d’une presse libre et indépendante pour la démocratie et le développement du Sénégal.

Vers un dialogue renouveléMalgré cette victoire, les tensions persistent. Le CDEPS appelle à un « dialogue rénové » avec la presse sénégalaise, soulignant l’importance d’une presse libre et indépendante pour la démocratie et le développement du Sénégal.

Malgré cette victoire, les tensions persistent. Le CDEPS appelle à un « dialogue rénové » avec la presse sénégalaise, soulignant l’importance d’une presse libre et indépendante pour la démocratie et le développement du Sénégal.",https://www.senenews.com/actualites/derniere-minute-validation-des-medias-par-letat-du-senegal-la-justice-donne-raison-a-aissatou-diop-fall_545523.html
SeneNews,Actualité,"DIRECT : Le calvaire de Farba Ngom à Rebeuss, Moustapha Diakhaté incarcéré, Macky Sall vise l’ONU",12/06/2025 à 16:29,2025-06-12 16:29,Barry Souleymane,"﻿DIRECT : Le calvaire de Farba Ngom à Rebeuss, Moustapha Diakhaté incarcéré, Macky Sall vise l’ONU",https://www.senenews.com/actualites/direct-le-calvaire-de-farba-ngom-a-rebeuss-moustapha-diakhate-incarcere-macky-sall-vise-lonu_545525.html
SeneNews,Sport,Officiel : Youssouf Sabaly signe à Al-Duhail au Qatar !,12/06/2025 à 16:28,2025-06-12 16:28,Kabir Sall,"C’est désormais officiel : Youssouf Sabaly, le défenseur sénégalais, rejoint le club qatari d’Al-Duhail pour une nouvelle aventure dans sa carrière.

Les supporters qataris attendent avec impatience les débuts de Sabaly, qui promet d’apporter sa hargne et son talent sur les terrains du Golfe. Le défenseur sénégalais portera le numéro 17.✍️ الدحيل يتعاقد مع المدافع السنغالي يوسف سابالي#الدحيل|#قطر— Al Duhail SC | نادي الدحيل (@DuhailSC)June 12, 2025

✍️ الدحيل يتعاقد مع المدافع السنغالي يوسف سابالي#الدحيل|#قطر— Al Duhail SC | نادي الدحيل (@DuhailSC)June 12, 2025

— Al Duhail SC | نادي الدحيل (@DuhailSC)June 12, 2025",https://www.senenews.com/actualites/sport/officiel-youssouf-sabaly-signe-a-al-duhail-au-qatar_545522.html
SeneNews,Sport,Sport et Education : Abdou Diallo va offrir une formation au Qatar à 22 jeunes Sénégalais,12/06/2025 à 16:12,2025-06-12 16:12,Kabir Sall,"Abdou Diallo, le défenseur international sénégalais, s’engage à nouveau pour aider la jeune sénégalaise à se former dans les métiers du sport et de la communication. Grâce à l’initiative Generation Amazing, 22 jeunes Sénégalais vont recevoir une formation au Qatar lors de la Coupe du monde des moins de 17 ans.

Abdou Diallo, figure emblématique, inspire ces jeunes à rêver grand. Le défenseur sénégalais, qui va rejoindre le programme social Generation Amazing aux côtés de grands noms du football comme Pep Guardiola, Xavi ou Beckham, va booster et accompagner plusieurs jeunes à se former dans les métiers du sport et de la communication.Generation Amazing est un programme social lancé lors de la Coupe du monde au Qatar, qui utilise le sport pour éduquer, inspirer et créer des opportunités pour la jeunesse dans le monde entier. Un projet ambitieux, qui va utiliser la puissance du sport au service de l’éducation.Pour rappel, la prochaine Coupe du monde des moins de 17 ans se déroulera au Qatar du 3 au 27 novembre 2025. Le Sénégal prendra part à cette compétition. Les Lions sont logés dans le groupe C avec la Croatie, le Costa Rica et les Émirats arabes unis.

Generation Amazing est un programme social lancé lors de la Coupe du monde au Qatar, qui utilise le sport pour éduquer, inspirer et créer des opportunités pour la jeunesse dans le monde entier. Un projet ambitieux, qui va utiliser la puissance du sport au service de l’éducation.Pour rappel, la prochaine Coupe du monde des moins de 17 ans se déroulera au Qatar du 3 au 27 novembre 2025. Le Sénégal prendra part à cette compétition. Les Lions sont logés dans le groupe C avec la Croatie, le Costa Rica et les Émirats arabes unis.

Pour rappel, la prochaine Coupe du monde des moins de 17 ans se déroulera au Qatar du 3 au 27 novembre 2025. Le Sénégal prendra part à cette compétition. Les Lions sont logés dans le groupe C avec la Croatie, le Costa Rica et les Émirats arabes unis.",https://www.senenews.com/actualites/sport/sport-et-education-abdou-diallo-va-offrir-une-formation-au-qatar-a-22-jeunes-senegalais_545518.html
SeneNews,International,Gold card aux Etats-Unis : Voici le site de Trump pour le visa permanent à 5 millions de dollars,12/06/2025 à 15:50,2025-06-12 15:50,Thierno Gueye,"L’ex-président américain Donald Trump a dévoilé mercredi le lancement du site TrumpCard.gov, dédié à un nouveau visa permanent baptisé « Gold Card », une carte dorée censée offrir la résidence permanente aux États-Unis pour la somme de 5 millions de dollars. Ce programme, inspiré du modèle de la « green card », ambitionne de séduire les grandes fortunes mondiales.

Sur les réseaux sociaux,Donald Trumps’est félicité de l’intérêt que suscite déjà cette initiative : « Des milliers de personnes ont appelé pour demander comment s’inscrire », a-t-il déclaré, précisant qu’une liste d’attente est déjà ouverte, même si les cartes ne sont pas encore disponibles. Déjà en avril, à bord de l’avion présidentiel Air Force One, Trump avait présenté un prototype de la fameuse carte dorée, arborant son propre visage. Il promettait alors une mise en circulation sous deux semaines, promesse non encore tenue à ce jour.Ce projet rappelle le programme EB-5, qui accorde une carte verte à des investisseurs étrangers en échange d’un investissement substantiel. Mais selon l’équipe Trump, ce système serait trop vulnérable aux fraudes. La « Gold Card », en revanche, se veut plus exclusive et sécurisée. « Ces gens seront riches, créeront des emplois, paieront des impôts et injecteront des milliards dans l’économie américaine », avait plaidé Trump en février. Il estime que les ventes pourraient atteindre un million de cartes, générant potentiellement 5 000 milliards de dollars.

Ce projet rappelle le programme EB-5, qui accorde une carte verte à des investisseurs étrangers en échange d’un investissement substantiel. Mais selon l’équipe Trump, ce système serait trop vulnérable aux fraudes. La « Gold Card », en revanche, se veut plus exclusive et sécurisée. « Ces gens seront riches, créeront des emplois, paieront des impôts et injecteront des milliards dans l’économie américaine », avait plaidé Trump en février. Il estime que les ventes pourraient atteindre un million de cartes, générant potentiellement 5 000 milliards de dollars.",https://www.senenews.com/actualites/international/gold-card-aux-etats-unis-voici-le-site-de-trump-pour-le-visa-permanent-a-5-millions-de-dollars_545488.html
SeneNews,Multimedia,"Voici Vishwash Kumar Ramesh, le seul survivant du crash mortel du vol Air-Indian (vidéo)",12/06/2025 à 15:35,2025-06-12 15:35,Kabir Sall,"En Inde, le ressortissant britannique Vishwash Kumar Ramesh, le seul survivant du crash mortel du vol Air-Indian, de ce jeudi 12 juin, qui était à destination de Londres avec 242 personnes à bord.

— LSI AFRICA (@lsiafrica)June 12, 2025",https://www.senenews.com/actualites/societe/voici-vishwash-kumar-ramesh-le-seul-survivant-du-crash-mortel-du-vol-air-indian-video_545513.html
SeneNews,Afrique - actualité,"Abdoulaye Diop, ministre malien : « Les pays de l’AES feront les élections à leur rythme »",12/06/2025 à 15:27,2025-06-12 15:27,Thierno Gueye,,https://www.senenews.com/actualites/afrique/abdoulaye-diop-ministre-malien-les-pays-de-laes-feront-les-elections-a-leur-rythme_545485.html
SeneNews,People,Ticket Laobé : « Proposé nagn mafi chirurgie manilen khana daguen nameu deukhine » (vidéo),12/06/2025 à 15:10,2025-06-12 15:10,Khadija Sène,"L’actrice Ticket Laobé a fermement exprimé son opposition à la chirurgie esthétique. Interrogée sur le sujet, elle a révélé avoir déjà reçu des propositions, mais sa réponse a toujours été catégorique.

« Je ne recourrai jamais à la chirurgie esthétique, car il existe d’autres méthodes pour perdre du poids », a-t-elle déclaré.Ticket Laobéprivilégie ainsi les solutions naturelles : « Les thés minceur et le sport sont là pour ça. Quand on m’a proposé la chirurgie, j’ai immédiatement refusé. »",https://www.senenews.com/senenews-people/ticket-laobe-propose-nagn-mafi-chirurgie-manilen-khana-daguen-nameu-deukhine-video_545510.html
SeneNews,Politique,Tournée à Saint-Louis : Les pros Mansour Faye se signalent face à Bassirou Diomaye Faye,12/06/2025 à 15:02,2025-06-12 15:02,Modou Mamoune Tine,"Le président de la République, Bassirou Diomaye Faye, est attendu ce mercredi après-midi à Saint-Louis dans le cadre de sa tournée nationale. Mais à l’annonce de sa visite, une vive tension s’est installée dans la ville tricentenaire.

Des partisans du maire emprisonné Mansour Faye, affilié à l’APR, annoncent déjà un accueil hostile. Selon RFM, ils entendent manifester leur colère face à ce qu’ils considèrent comme une injustice politique. « Ce n’est pas une tournée économique, c’est une tournée politique, une suite du ‘Nemmekou Tour’. Comment peut-il emprisonner notre maire et venir à Saint-Louis ? », a fustigé Aminata Gueye, adjointe au maire et ancienne députée. Pour elle, la présence du chef de l’État dans la ville n’est rien d’autre qu’une provocation.Les partisans du maire annoncent une manifestation symbolique avec des brassards rouges et prévoient de faire entendre leur mécontentement sur le terrain. Aminata Gueye dénonce un agenda politique masqué derrière cette tournée : « Il n’y a ni pose de première pierre, ni projet concret. Il vient juste provoquer les militants et sympathisants de l’APR ». L’adjointe au maire soutient que l’emprisonnement deMansour Faye, poursuivi dans le cadre de la gestion des fonds Force Covid-19, serait une manœuvre pour affaiblir l’opposition en vue des élections locales. « Ils pensent que ça va être facile, mais ils vont nous trouver sur le terrain », avertit-elle avec fermeté.

Les partisans du maire annoncent une manifestation symbolique avec des brassards rouges et prévoient de faire entendre leur mécontentement sur le terrain. Aminata Gueye dénonce un agenda politique masqué derrière cette tournée : « Il n’y a ni pose de première pierre, ni projet concret. Il vient juste provoquer les militants et sympathisants de l’APR ». L’adjointe au maire soutient que l’emprisonnement deMansour Faye, poursuivi dans le cadre de la gestion des fonds Force Covid-19, serait une manœuvre pour affaiblir l’opposition en vue des élections locales. « Ils pensent que ça va être facile, mais ils vont nous trouver sur le terrain », avertit-elle avec fermeté.",https://www.senenews.com/actualites/tournee-a-saint-louis-les-pros-mansour-faye-se-signalent-face-a-bassirou-diomaye-faye_545498.html
SeneNews,Actualité,Ziguinchor : Un adolescent de 13 ans poignardé à mort à Santhiaba,12/06/2025 à 14:52,2025-06-12 14:52,Khadija Sène,"Un drame a secoué le quartier populaire de Santhiaba, à Ziguinchor, ce jeudi 12 juin. Un jeune garçon de 13 ans a été mortellement poignardé lors d’une altercation avec un autre mineur, selon des sources locales.

Ce nouveau drame soulève de vives inquiétudes quant à la sécurité des mineurs dans certains quartiers sensibles de Ziguinchor, où la violence juvénile semble s’intensifier.",https://www.senenews.com/actualites/ziguinchor-un-adolescent-de-13-ans-poignarde-a-mort-a-santhiaba_545507.html
SeneNews,Live,DIRECT : Anatole Collinet Makosso et Ousmane Sonko font le point devant la presse,12/06/2025 à 14:51,2025-06-12 14:51,Modou Mamoune Tine,,https://www.senenews.com/en-direct-live/direct-anatole-collinet-makosso-et-ousmane-sonko-font-le-point-devant-la-presse_545506.html
SeneNews,International,Crash d’avion avec 230 passagers : Le patron d’Air India suggère qu’il y a eu des survivants,12/06/2025 à 14:51,2025-06-12 14:51,Modou Mamoune Tine,"Alors que la police d’Ahmedabad a affirmé qu’« il n’y a apparemment aucun survivant » suite au crash du vol AI 171, le CEO d’Air India, Campbell Wilson, sème le doute.

Ce revirement soulève plusieurs questions : existe-t-il vraiment des personnes sorties vivantes de la catastrophe ? Le message de Campbell Wilson suggère que les secours ont trouvé des blessés, ce que certaines sources, comme NDTV et les autorités locales, confirmèrent dans la soirée en évoquant au moins un survivant repéré et admis à l’hôpital . Officiellement, Ahmedabad comptabilise au moins un rescapé : un passager britannique, blessé, hospitalisé selon The Guardian et d’autres médias. Ces éléments invitent à la prudence : les efforts de secours sont encore en cours et le bilan humain pourrait spontanément évoluer.Le contraste entre les déclarations policières initiales et celles d’Air Indiapourrait expliquer les doutes encore entourant le bilan officiel du drame. L’annonce du transport de blessés invite à attendre les prochaines confirmations médicales et officielles avant d’écarter toute survivance parmi les passagers.

Le contraste entre les déclarations policières initiales et celles d’Air Indiapourrait expliquer les doutes encore entourant le bilan officiel du drame. L’annonce du transport de blessés invite à attendre les prochaines confirmations médicales et officielles avant d’écarter toute survivance parmi les passagers.",https://www.senenews.com/actualites/international/crash-davion-avec-230-passagers-le-patron-dair-india-suggere-quil-y-a-eu-des-survivants_545504.html
SeneNews,Politique,Poste de SG de l’ONU : Thierno Alassane Sall et les discussions entre le régime et Macky Sall,12/06/2025 à 14:41,2025-06-12 14:41,Thierno Gueye,"Alors que des rumeurs persistantes évoquent une probable candidature de l’ancien président Macky Sall au poste de Secrétaire général de l’Organisation des Nations Unies (ONU), les réactions au sein de la classe politique sénégalaise se multiplient.",https://www.senenews.com/actualites/poste-de-sg-de-lonu-thierno-alassane-sall-et-les-discussions-entre-le-regime-et-macky-sall_545501.html
