source,theme,titre,date,date_parsed,auteur,contenu,url
SeneNews,Afrique - actualité,"Mali : Le projet de loi adopté, vers un mandat illimité pour Assimi Goïta",12/06/2025 à 11:37,2025-06-12 11:37,Thierno Gueye,"Au Mali, un projet de loi adopté mercredi 11 juin en conseil des ministres prévoit d’accorder au général Assimi Goïta un mandat présidentiel de cinq ans renouvelable, sans échéance électorale prévisible. Déjà à la tête de la Transition depuis le coup d’État d’août 2020, le chef de l’État malien pourrait ainsi conserver le pouvoir de manière indéfinie, au nom d’un impératif de « pacification totale » du Mali, mais aussi du Niger et du Burkina Faso, les deux autres membres de l’Alliance des États du Sahel (AES).

La référence floue à une menace « internationale » évoque implicitement les accusations fréquentes et non étayées de collusion entre la France et des groupes armés. Ce projet de loi, qui prévoit de modifier la charte de transition adoptée après le putsch de 2020 et déjà amendée en 2022, illustre un glissement assumé vers un pouvoir militaire consolidé, sans horizon électoral clair. Une question symbolique demeure :Assimi Goïtaconservera-t-il le titre de « président de la Transition » ou endossera-t-il celui de « président de la République » ? Quoi qu’il en soit, dans un Mali privé de partis politiques et où la société civile est muselée, le terme même de transition semble vidé de son sens.Les réactions à cette annonce sont révélatrices d’un climat politique profondément divisé. Tandis que les partisans du régime célèbrent une victoire contre l’« impérialisme occidental » et saluent la construction d’un État « souverain et digne », les voix critiques dénoncent un « braquage politique ». Le journaliste malien en exil Malick Konaté déplore un « enterrement en grande pompe du Mali républicain », affirmant que « le régime militaire n’est plus déguisé, il est paré du boubou neuf de la dictature ». Cette réforme controversée pourrait donc marquer le point de non-retour d’un processus de militarisation du pouvoir dans la région sahélienne.

Les réactions à cette annonce sont révélatrices d’un climat politique profondément divisé. Tandis que les partisans du régime célèbrent une victoire contre l’« impérialisme occidental » et saluent la construction d’un État « souverain et digne », les voix critiques dénoncent un « braquage politique ». Le journaliste malien en exil Malick Konaté déplore un « enterrement en grande pompe du Mali républicain », affirmant que « le régime militaire n’est plus déguisé, il est paré du boubou neuf de la dictature ». Cette réforme controversée pourrait donc marquer le point de non-retour d’un processus de militarisation du pouvoir dans la région sahélienne.",https://www.senenews.com/actualites/afrique/mali-le-projet-de-loi-adopte-vers-un-mandat-illimite-pour-assimi-goita_545436.html
SeneNews,Actualité,Alerte météo : Des pluies et orages dans plusieurs régions du pays (ANACIM),12/06/2025 à 11:34,2025-06-12 11:34,Khadija Sène,"L’Agence Nationale de l’Aviation Civile et de la Météorologie du Sénégal (ANACIM) a publié son bulletin météo n°162, valable du 11 juin à 12h00 au 12 juin à 12h00.

Prévisions régionales :– Thiès : Ensoleillé, 24-33°C, vents de sud-ouest.-Saint-Louis : Ensoleillé et chaud, 25-31°C, vents de sud-ouest.– Louga : Ensoleillé et chaud, 22-47°C, vents de sud-ouest.-Diourbel : Ensoleillé et chaud, 25-40°C, vents de sud-ouest.– Kaffrine : Pluies faibles et très chaud, 27-41°C, vents de sud-ouest.– Fatick : Ensoleillé et chaud, 25-38°C, vents de sud-ouest.– Kaolack : Ensoleillé et chaud, 25-37°C, vents de sud-ouest.– Tambacounda : Orages et pluie, très chaud, 26-40°C, vents de sud-ouest.– Matam : Ensoleillé et très chaud, 30-43°C, vents de sud-ouest. Goudiry et Bakel : pluies faibles, très chaud, 29-43°C, vents de sud-ouest.– Kédougou : Orages et pluie, chaud, 22-35°C, vents de sud-ouest.– Kolda : Orages et pluie, chaud, 25-38°C, vents de sud-ouest.– Ziguinchor : Orages et pluie, chaud, 24-34°C, vents de sud-ouest. Sédhiou : orages et pluie, chaud, 25-38°C, vents de sud-ouest. Cap Skirring : chaud, 27-32°C, vents de sud-ouest.

– Thiès : Ensoleillé, 24-33°C, vents de sud-ouest.-Saint-Louis : Ensoleillé et chaud, 25-31°C, vents de sud-ouest.– Louga : Ensoleillé et chaud, 22-47°C, vents de sud-ouest.-Diourbel : Ensoleillé et chaud, 25-40°C, vents de sud-ouest.– Kaffrine : Pluies faibles et très chaud, 27-41°C, vents de sud-ouest.– Fatick : Ensoleillé et chaud, 25-38°C, vents de sud-ouest.– Kaolack : Ensoleillé et chaud, 25-37°C, vents de sud-ouest.– Tambacounda : Orages et pluie, très chaud, 26-40°C, vents de sud-ouest.– Matam : Ensoleillé et très chaud, 30-43°C, vents de sud-ouest. Goudiry et Bakel : pluies faibles, très chaud, 29-43°C, vents de sud-ouest.– Kédougou : Orages et pluie, chaud, 22-35°C, vents de sud-ouest.– Kolda : Orages et pluie, chaud, 25-38°C, vents de sud-ouest.– Ziguinchor : Orages et pluie, chaud, 24-34°C, vents de sud-ouest. Sédhiou : orages et pluie, chaud, 25-38°C, vents de sud-ouest. Cap Skirring : chaud, 27-32°C, vents de sud-ouest.",https://www.senenews.com/actualites/alerte-meteo-des-pluies-et-orages-dans-plusieurs-regions-du-pays-anacim_545434.html
SeneNews,Politique,"Récit d’une garde à vue « mouvementée » : Moustapha Diakhaté, les lunettes et les médicaments",12/06/2025 à 11:24,2025-06-12 11:24,Modou Mamoune Tine,"Ministre-conseiller sous Macky Sall, Moustapha Diakhaté a été placé sous mandat de dépôt hier, pour offense au chef de l’État. Cela fait suite à une garde à vue « mouvementée » au Commissariat du Port.

Il a également révélé que « le Commissaire du Port a refusé queMoustapha Diakhatégarde ses lunettes, car elles font partie des objets – à l’instar des ceintures – interdits dans les cellules de garde à vue. Le même refus lui a été opposé lorsqu’il a demandé à disposer d’un livre dans la chambre de sécurité. Toutefois, sur sa demande, le Commissaire l’a autorisé à avoir sa natte de prière dans la cellule », a-t-il ajouté. Ce n’est que le lendemain, mercredi, que les éléments de la Dic sont venus récupérer Moustapha Diakhaté, qui a ensuite été placé sous mandat de dépôt. Selon son avocat, Me El Hadji Diouf, il sera jugé le 18 juin prochain devant le Tribunal des flagrants délits de Dakar.",https://www.senenews.com/actualites/recit-dune-garde-a-vue-mouvementee-moustapha-diakhate-les-lunettes-et-les-medicaments_545430.html
SeneNews,Société,Cheikh Everywhere en prison : Il avait tout raconté dans une vidéo sur TikTok (vidéo),12/06/2025 à 11:18,2025-06-12 11:18,Khadija Sène,"L’influenceur Cheikh Everywhere, connu pour ses vidéos sur TikTok, a été placé en détention. Selon les informations qui circulent sur les réseaux sociaux, cette incarcération serait liée à un différend familial.

L’affaire a suscité de nombreuses réactions sur les réseaux sociaux, où les fans de l’influenceur expriment leur soutien et attendent de connaître les développements de cette affaire.@youssou_41♬ son original – Youshow🎙️",https://www.senenews.com/actualites/societe/justice-societe/cheikh-everywhere-en-prison-il-avait-tout-raconte-dans-une-video-sur-tiktok-video_545428.html
SeneNews,International,"Premières images du crash en Inde : 169 Indiens, 53 Britanniques, 7 Portugais et 1 Canadien à bord (vidéo)",12/06/2025 à 10:59,2025-06-12 10:59,Thierno Gueye,"Le vol Air India 171, qui assurait la liaison entre la ville d’Ahmedabad, dans le nord-ouest de l’Inde, et l’aéroport de Londres-Gatwick, s’est écrasé peu après son décollage ce jeudi, provoquant une vive émotion en Inde comme à l’étranger. L’appareil, un Boeing 787 long-courrier, a quitté le sol à 13h39, heure locale, avant d’émettre un signal d’urgence et de s’écraser à l’extérieur du périmètre de l’aéroport.

— TIMES NOW (@TimesNow)June 12, 2025

Le crash a provoqué une onde de choc dans les deux pays, en particulier dans les États indiens du Gujarat et du Maharashtra, d’où provenaient une grande partie des passagers, mais également dans plusieurs communautés britanniques ayant des liens avec la diaspora indienne.",https://www.senenews.com/actualites/international/premieres-images-du-crash-en-inde-169-indiens-53-britanniques-7-portugais-et-1-canadien-a-bord-video_545423.html
SeneNews,Société,Ama Baldé : Comment le lutteur a dribblé la police sénégalaise pour s’envoler vers la France,12/06/2025 à 10:44,2025-06-12 10:44,Modou Mamoune Tine,"Le lutteur Ama Baldé, présumé en cavale après une altercation survenue le 25 mai dernier avec l’un de ses agents, est désormais dans le collimateur de la Police de l’air et des frontières (DPAF). Le commissariat de Pikine avait émis un avis de recherche pour sa localisation, avec pour objectif une arrestation dès son retour au Sénégal.",https://www.senenews.com/justice/ama-balde-comment-le-lutteur-a-dribble-la-police-senegalaise-pour-senvoler-vers-la-france_545422.html
SeneNews,Politique,Audition : Ce que l’ancienne ministre Sophie Gladima a dit devant la Haute Cour de Justice,12/06/2025 à 10:32,2025-06-12 10:32,Thierno Gueye,,https://www.senenews.com/actualites/audition-ce-que-lancienne-ministre-sophie-gladima-a-dit-devant-la-haute-cour-de-justice_545421.html
SeneNews,Actualité,Retour de la Mecque : La pélerine Adja Momy Seck décède après l’atterrissage de l’avion à l’AIBD,12/06/2025 à 10:23,2025-06-12 10:23,Khadija Sène,"La Délégation générale au Pèlerinage a annoncé avec une profonde tristesse le décès d’Adja Momy Seck, une pèlerine âgée de 71 ans. Le drame s’est produit le 11 juin 2025, peu après l’atterrissage du vol inaugural des pèlerins sénégalais à l’AIBD. Selon les informations disponibles,Adja Momy Secka succombé à un malaise.",https://www.senenews.com/actualites/retour-de-la-mecque-la-pelerine-adja-momy-seck-decede-apres-latterrissage-de-lavion-a-laibd_545418.html
SeneNews,Actualité,Justice : Le tiktokeur Cheikh Everywhere envoyé en prison,12/06/2025 à 10:06,2025-06-12 10:06,Khadija Sène,"L’univers des réseaux sociaux est en émoi. Cheikh Everywhere, le célèbre influenceur, connu pour ses vidéos captivantes et son humour décalé, a été placé en détention. La nouvelle, qui a fait le tour de la toile, a suscité une vague de réactions parmi ses nombreux fans et abonnés.

Les informations disponibles, partagées sur les plateformes numériques, suggèrent que l’incarcération de Cheikh Everywhere serait liée à une affaire familiale. Selon les premières révélations, l’influenceur aurait pris la défense de sa tante paternelle, victime de maltraitance. Ce geste de solidarité aurait provoqué une réaction en chaîne, conduisant un membre de sa famille à porter plainte contre lui.Cette affaire met en lumière les complexités des relations familiales et les conséquences potentielles des conflits domestiques, même lorsqu’ils impliquent des personnalités publiques. Alors que l’enquête suit son cours, les fans deCheikh Everywhereattendent avec impatience de nouvelles informations, tout en espérant un dénouement rapide et favorable pour leur idole.

Cette affaire met en lumière les complexités des relations familiales et les conséquences potentielles des conflits domestiques, même lorsqu’ils impliquent des personnalités publiques. Alors que l’enquête suit son cours, les fans deCheikh Everywhereattendent avec impatience de nouvelles informations, tout en espérant un dénouement rapide et favorable pour leur idole.",https://www.senenews.com/actualites/justice-le-tiktokeur-cheikh-everywhere-envoye-en-prison_545416.html
SeneNews,Actualité,"Chirurgie esthétique : Entre BBL, liposuccion et autres… voici combien coûtent les opérations",12/06/2025 à 10:05,2025-06-12 10:05,Thierno Gueye,"Mais au-delà du coût financier, ce sont les séquelles physiques et psychologiques qui inquiètent : infections post-opératoires, troubles alimentaires, douleurs chroniques, voire décès. Adji Mass avoue : « J’étais à un pas de la mort. » Une autre victime confie ne plus pouvoir s’alimenter que de bouillie depuis six mois. Le moindre écart alimentaire provoque des douleurs insoutenables.Derrière ce business lucratif se cachent des pratiques douteuses. En Tunisie, des agences comme Glam Travel ciblent les influenceuses sénégalaises avec des opérations offertes contre promotion sur les réseaux sociaux. Mais comme le dit une patiente : « Quand le service est gratuit, c’est vous le produit. »

Derrière ce business lucratif se cachent des pratiques douteuses. En Tunisie, des agences comme Glam Travel ciblent les influenceuses sénégalaises avec des opérations offertes contre promotion sur les réseaux sociaux. Mais comme le dit une patiente : « Quand le service est gratuit, c’est vous le produit. »",https://www.senenews.com/actualites/chirurgie-esthetique-entre-bbl-liposuccion-et-autres-voici-combien-coutent-les-operations_545398.html
SeneNews,Actualité,Centre-ville de Dakar : Orabank Côte d’Ivoire saisit le site abritant l’hôtel Croix du Sud,12/06/2025 à 10:05,2025-06-12 10:05,Modou Mamoune Tine,"Plusieurs crédits non remboursés ont conduit Orabank Côte d’Ivoire à enclencher une procédure de saisie-vente visant un bien de prestige. Selon le journal Libération, la banque a saisi la Chambre des criées pour obtenir l’autorisation de vendre le bloc immobilier abritant l’hôtel Croix du Sud, un établissement situé en plein centre-ville de Dakar, derrière le siège du ministère des Affaires étrangères.

Ce montant, plus conséquent, fait également partie des créances que la banque tente de recouvrer à travers cette opération judiciaire. La mise à prix globale du bloc immobilier saisi parOrabanka été fixée à 2 milliards de francs CFA. Le verdict du tribunal, qui décidera de la tenue effective de la vente aux enchères, est attendu pour le 1er juillet prochain.",https://www.senenews.com/actualites/centre-ville-de-dakar-orabank-cote-divoire-saisit-le-site-abritant-lhotel-croix-du-sud_545414.html
SeneNews,Politique,"Bassirou Diomaye Faye, les raisons d’un nouveau voyage à New York",12/06/2025 à 09:56,2025-06-12 09:56,Modou Mamoune Tine,"Le président de la République du Sénégal, Bassirou Diomaye Faye, s’apprête à effectuer deux déplacements diplomatiques d’envergure dans les prochains jours.

Ce déplacement aux États-Unis intervient alors que le Sénégal continue de jouer un rôle actif au sein des instances diplomatiques internationales, en particulier sur les questions de paix, de droits humains et de solidarité internationale. La participation du président Bassirou Diomaye Faye à cette conférence témoigne de l’engagement constant de Dakar en faveur d’une solution juste et durable au conflit israélo-palestinien.Dans la foulée de ce déplacement, le président sénégalais rejoindra Abuja, la capitale fédérale du Nigeria, où il participera le 22 juin 2025 au sommet de la Communauté économique des États de l’Afrique de l’Ouest (CEDEAO). Ce sommet s’annonce déterminant pour la stabilité régionale, notamment face aux tensions persistantes dans l’espace sahélien et aux défis de gouvernance démocratique dans plusieurs États membres.

Dans la foulée de ce déplacement, le président sénégalais rejoindra Abuja, la capitale fédérale du Nigeria, où il participera le 22 juin 2025 au sommet de la Communauté économique des États de l’Afrique de l’Ouest (CEDEAO). Ce sommet s’annonce déterminant pour la stabilité régionale, notamment face aux tensions persistantes dans l’espace sahélien et aux défis de gouvernance démocratique dans plusieurs États membres.",https://www.senenews.com/actualites/bassirou-diomaye-faye-les-raisons-dun-nouveau-voyage-a-new-york_545410.html
SeneNews,Actualité,"Pour s’offrir de nouveaux habits pour la Tabaski, un étudiant vole 370 000 FCFA et les perd avec 1Xbet",12/06/2025 à 09:56,2025-06-12 09:56,Khadija Sène,"Demba Sarr a une conception bien particulière des préparatifs de la fête de la Tabaski. Étudiant de son état, il travaillait dans une quincaillerie installée à Saly Portudal. Selon L’Observateur, c’est courant mai que le jeune homme a frauduleusement soutiré une somme de 370 000 FCFA, qu’il a ensuite entièrement engloutie dans les paris sportifs.

Grâce à l’intervention de sa mère, qui a remboursé intégralement la somme détournée à la gérante, Demba Sarr a été reconnu coupable mais a bénéficié de circonstances atténuantes : il a été condamné à trois mois de prison assortis du sursis.",https://www.senenews.com/actualites/pour-soffrir-de-nouveaux-habits-pour-la-tabaski-un-etudiant-vole-370-000-fcfa-et-les-perd-avec-1xbet_545411.html
SeneNews,Actualité,Décès de Ngoné Ndiaye après sa chirurgie : Les nouvelles révélations de la presse anglaise,12/06/2025 à 09:50,2025-06-12 09:50,Khadija Sène,"De nombreuses jeunes femmes sont tombées malades ou sont décédées des suites d’une opération BBL en Turquie. Le mannequin Ngoné Ndiaye est décédée tragiquement après avoir subi une opération de lifting des fesses en Turquie.

Ngoné Ndiaye a suscité des inquiétudes après que sa famille a perdu contact avec elle lorsqu’elle s’est rendue dans le pays pour une intervention dangereuse. Sa mère en deuil a confirmé qu’elle espérait subir une intervention chirurgicale pour résoudre un problème lié à un lifting brésilien des fesses, autrement connu sous le nom de BBL.Un BBL est utilisé pour donner aux fesses une apparence plus grosse, arrondie et relevée. Les chirurgiens transfèrent de la graisse, injectent des produits de comblement ou insèrent des implants remplis de silicone.Ngoné Ndiayecomptait près de 100 000 abonnés sur Instagram et était réputée pour son contenu de mode en ligne. En 2008, elle a été couronnée Miss Pikine après avoir représenté sa ville natale de Pikine, au Sénégal, en Afrique de l’Ouest.Elle a travaillé avec de nombreux stylistes locaux et a participé à divers événements culturels. Ngone a vécu en France avant de mourir. Après le retour de sa dépouille au Sénégal, sa famille et ses amis en deuil se sont réunis pour lui rendre un dernier hommage, rapportent les médias locaux.

Un BBL est utilisé pour donner aux fesses une apparence plus grosse, arrondie et relevée. Les chirurgiens transfèrent de la graisse, injectent des produits de comblement ou insèrent des implants remplis de silicone.Ngoné Ndiayecomptait près de 100 000 abonnés sur Instagram et était réputée pour son contenu de mode en ligne. En 2008, elle a été couronnée Miss Pikine après avoir représenté sa ville natale de Pikine, au Sénégal, en Afrique de l’Ouest.Elle a travaillé avec de nombreux stylistes locaux et a participé à divers événements culturels. Ngone a vécu en France avant de mourir. Après le retour de sa dépouille au Sénégal, sa famille et ses amis en deuil se sont réunis pour lui rendre un dernier hommage, rapportent les médias locaux.

Ngoné Ndiayecomptait près de 100 000 abonnés sur Instagram et était réputée pour son contenu de mode en ligne. En 2008, elle a été couronnée Miss Pikine après avoir représenté sa ville natale de Pikine, au Sénégal, en Afrique de l’Ouest.Elle a travaillé avec de nombreux stylistes locaux et a participé à divers événements culturels. Ngone a vécu en France avant de mourir. Après le retour de sa dépouille au Sénégal, sa famille et ses amis en deuil se sont réunis pour lui rendre un dernier hommage, rapportent les médias locaux.

Elle a travaillé avec de nombreux stylistes locaux et a participé à divers événements culturels. Ngone a vécu en France avant de mourir. Après le retour de sa dépouille au Sénégal, sa famille et ses amis en deuil se sont réunis pour lui rendre un dernier hommage, rapportent les médias locaux.",https://www.senenews.com/actualites/deces-de-ngone-ndiaye-apres-sa-chirurgie-les-nouvelles-revelations-de-la-presse-anglaise_545403.html
SeneNews,International,"Meurtre : Silentó, auteur de la célèbre chanson « Watch Me », écope de 30 ans de prison",12/06/2025 à 09:40,2025-06-12 09:40,Modou Mamoune Tine,"Le rappeur américain Silentó, célèbre pour son tube viral Watch Me (Whip/Nae Nae) en 2015, a été condamné mercredi 11 juin à 30 ans de prison pour homicide volontaire.",https://www.senenews.com/actualites/international/meurtre-silento-auteur-de-la-celebre-chanson-watch-me-ecope-de-30-ans-de-prison_545407.html
SeneNews,International,"Inde : Crash d’un avion à destination de l’Angleterre avec 242 personnes à bord, les secours mobilisés",12/06/2025 à 09:36,2025-06-12 09:36,Thierno Gueye,"Un grave accident d’avion est survenu ce jeudi à l’aéroport international Sardar Vallabhbhai Patel d’Ahmedabad, dans l’ouest de l’Inde. Un appareil de la compagnie Air India, en partance pour Londres, s’est écrasé au moment du décollage, ont rapporté plusieurs chaînes de télévision indiennes.",https://www.senenews.com/actualites/international/inde-crash-dun-avion-a-destination-de-langleterre-avec-242-personnes-a-bord-les-secours-mobilises_545402.html
SeneNews,Politique,Le président Bassirou Diomaye Faye va rencontrer les guides religieux,12/06/2025 à 09:28,2025-06-12 09:28,Modou Mamoune Tine,"Le chef de l’État a informé le Gouvernement de sa volonté d’instaurer une rencontre nationale annuelle avec les guides religieux et les chefs coutumiers. Cette initiative vise à renforcer le dialogue interreligieux et à consolider les liens entre l’État et les autorités spirituelles et traditionnelles. Lors de son intervention, le présidentBassirou Diomaye Fayea salué l’exemplarité du vivre-ensemble observée durant les récentes fêtes religieuses de la Tabaski et de la Pentecôte.Il a insisté sur la nécessité de préserver cette harmonie qui fait la spécificité du modèle sénégalais de cohabitation entre les confessions. Il a ainsi demandé au Gouvernement de mobiliser les ressources nécessaires pour moderniser les sites religieux sur l’ensemble du territoire national et faciliter l’exercice du culte, quelles qu’en soient les confessions. En érigeant cette rencontre en événement national annuel, le président entend créer un cadre d’échange institutionnel avec les acteurs religieux et coutumiers, au-delà des consultations ponctuelles.

Il a insisté sur la nécessité de préserver cette harmonie qui fait la spécificité du modèle sénégalais de cohabitation entre les confessions. Il a ainsi demandé au Gouvernement de mobiliser les ressources nécessaires pour moderniser les sites religieux sur l’ensemble du territoire national et faciliter l’exercice du culte, quelles qu’en soient les confessions. En érigeant cette rencontre en événement national annuel, le président entend créer un cadre d’échange institutionnel avec les acteurs religieux et coutumiers, au-delà des consultations ponctuelles.",https://www.senenews.com/actualites/le-president-bassirou-diomaye-faye-va-rencontrer-les-guides-religieux_545401.html
SeneNews,Sport,"48 heures après le match, on sait enfin pourquoi l’arbitre a refusé le but égalisateur de l’Angleterre",12/06/2025 à 09:18,2025-06-12 09:18,Modou Mamoune Tine,"Le choc amical entre le Sénégal et l’Angleterre, disputé à Nottingham, restera dans les annales du football africain. Les Lions de la Teranga y ont signé une victoire historique (3-1), devenant la première nation africaine à battre les Three Lions. Mais si cette performance est célébrée sur le continent, elle suscite une vive polémique en Angleterre. La cause : un but égalisateur de Jude Bellingham, annulé après intervention de la VAR. Une décision de l’arbitre française Stéphanie Frappart qui a provoqué l’indignation des joueurs anglais.

Quelques minutes après cette décision controversée, le Sénégal a inscrit un troisième but, scellant définitivement le sort du match. Si les regrets sont profonds côté anglais, le règlement offre peu de place à l’interprétation dans ce type de situation. Le débat reste ouvert, mais sur le plan réglementaire, la décision de Stéphanie Frappart apparaît conforme aux règles du football moderne.",https://www.senenews.com/actualites/48-heures-apres-le-match-on-sait-enfin-pourquoi-larbitre-a-refuse-le-but-egalisateur-de-langleterre_545250.html
SeneNews,Premium,Chirurgie esthétique : Lumière sur le business lucratif qui a emporté Ngoné Ndiaye,12/06/2025 à 09:15,2025-06-12 09:15,Thierno Gueye,Pourquoi vous devez soutenir l’initiative Senenews Premium?,https://www.senenews.com/premium/chirurgie-esthetique-lumiere-sur-le-business-lucratif-qui-a-emporte-ngone-ndiaye_545396.html
SeneNews,Actualité,"Les frontières sous surveillance, la DPAF en alerte, l’étau se resserre autour de Ama Baldé",12/06/2025 à 09:06,2025-06-12 09:06,Modou Mamoune Tine,"Face à cette situation, le commissariat de Pikine reste en alerte, gardant un œil attentif non seulement sur le domicile familial à Pikine, mais également sur la résidence d’Ama Baldé à Niagues, dans la commune de Tivaouane Peulh.",https://www.senenews.com/actualites/les-frontieres-sous-surveillance-la-dpaf-en-alerte-letau-se-resserre-autour-de-ama-balde_545393.html
