source,theme,titre,date,date_parsed,auteur,contenu,url
Senego,Société,"Affaire Jérôme Bandiaky : Sniper et le frère de Doudou Kâ renvoyés en jugement, le lutteur « Mbeuss » remis en liberté","12 juin 2025, 07:48",2025-06-12,Diéry DIALLO,"L’information judiciaire ouverte dans le cadre de l’affaire Jérôme Bandiaky a été clôturée. Le Doyen des juges a rendu son ordonnance, fixant désormais le sort des trois personnes impliquées dans ce dossier sensible.
Selon le quotidien Libération parcouru par Senego, deux des mis en cause, à savoir Jérôme Bandiaky alias « Sniper » – considéré comme le principal accusé – et Sakory Kâ, frère de l’ancien ministre Doudou Kâ, ont été renvoyés devant le tribunal correctionnel. En revanche, le troisième prévenu, le lutteur Bathie Bâ, plus connu sous le nom de « Mbeuss », a bénéficié d’un non-lieu. Il a été remis en liberté immédiatement après la notification de l’ordonnance.
« Sniper » devra répondre de plusieurs chefs d’accusation lourds : détention illégale et trafic illicite d’armes, détention non autorisée de munitions, obtention d’avantages indus et escroquerie au service. Il est soupçonné d’avoir joué un rôle central dans des opérations ciblées, notamment lors des périodes de tensions politiques sous la présidence de Macky Sall.
De son côté, Sakory Kâ est poursuivi pour détention non autorisée d’armes et de munitions, ainsi que pour trafic illicite d’armes.",https://senego.com/affaire-jerome-bandiaky-sniper-et-le-frere-de-doudou-ka-renvoyes-en-jugement-le-lutteur-mbeuss-remis-en-liberte_1847664.html
Senego,People,"Accident mortel à Mbour : un talibé décède, le conducteur en fuite","12 juin 2025, 16:05",2025-06-12,Faty BA,"Un accident tragique s’est déroulé tôt ce matin dans le quartier Santèssou à Mbour. Vers 6 heures, trois jeunes talibés ont été percutés par un véhicule particulier. L’un d’entre eux, gravement blessé, a malheureusement succombé à ses blessures à l’hôpital Thierno Mansour Barro.
Les deux autres victimes sont actuellement en soins intensifs, leur état de santé étant jugé préoccupant. L’automobiliste impliqué dans cet accident a pris la fuite, suscitant une vague d’émotion et d’indignation dans la communauté locale. Les autorités recherchent activement ce conducteur afin de faire la lumière sur les circonstances du drame.
Cette information a été initialement rapportée par nos confrères de Kawtef, mettant en exergue la dangerosité des routes et l’importance des mesures de sécurité routière, notamment dans les zones résidentielles.",https://senego.com/accident-mortel-a-mbour-un-talibe-decede-le-conducteur-en-fuite_1847877.html
Senego,Politique,Sonko plaide pour une coopération « gagnant-gagnant » entre le Sénégal et le Congo,"12 juin 2025, 16:20",2025-06-12,Mangoné KA,"En marge de la visite d’amitié et de travail du Premier ministre de la République du Congo, Anatole Collinet Makosso, le chef du gouvernement sénégalais, Ousmane Sonko, a animé un point de presse conjoint ce jeudi à Dakar. Une rencontre marquée par la volonté des deux pays d’approfondir leurs relations bilatérales, notamment dans les domaines de la défense, de l’enseignement supérieur et de l’exploitation des ressources naturelles.
« Nous avons considéré qu’il y avait mieux à faire, plus à faire dans le cadre de cette coopération avec le Congo », a déclaré Ousmane Sonko. Il a salué les acquis existants, tout en soulignant les marges de progression possibles, en particulier sur le plan économique.
Sur la coopération sécuritaire, le Premier ministre a rappelé l’existence d’un accord de défense déjà ratifié par Brazzaville, mais encore en attente de ratification par Dakar. « Nous allons nous organiser pour le faire le plus rapidement possible », a-t-il promis.
En matière d’enseignement, Sonko s’est montré satisfait : « Il y a beaucoup de jeunes Congolais qui poursuivent actuellement leur formation dans nos universités, et certains choisissent même de rester au Sénégal pour y travailler. »
Le bois, un enjeu stratégique
Mais c’est sur la question des ressources naturelles que le Premier ministre s’est longuement attardé. Prenant l’exemple du bois, il a évoqué les importants volumes importés par l’Afrique de l’Ouest, en grande partie issus du bassin congolais. « L’Afrique de l’Ouest importe pour plus de 513 millions de dollars de bois, dont l’essentiel provient du Congo et d’autres pays d’Afrique centrale, pour ensuite être transformé hors du continent. C’est une aberration économique », a-t-il dénoncé.
Le Sénégal, deuxième importateur de bois en Afrique de l’Ouest après le Nigeria, représente à lui seul 17 % des importations de la région. « Cela représente plus de 70 milliards de francs CFA. Voilà un axe de coopération très prometteur », a souligné Sonko.
Valoriser localement les matières premières
Le Premier ministre s’est félicité de la nouvelle dynamique engagée par le Congo, notamment l’interdiction de l’exportation de bois brut. « C’est la voie à suivre pour l’Afrique : transformer localement nos matières premières, au moins de manière primaire, sinon définitive. »
Dans cette perspective, il a évoqué l’opportunité pour le secteur privé sénégalais d’investir dans la transformation du bois au Congo, jusqu’à des produits à haute valeur ajoutée destinés au secteur immobilier ou au marché des contreplaqués. « Le bois transformé pourrait ensuite être acheminé vers le Sénégal, où nous pourrions en faire une plateforme d’exportation vers l’Afrique de l’Ouest », a-t-il expliqué.
Un comité mixte sera mis en place pour concrétiser ces axes de coopération, dans un esprit de partenariat équilibré. « Nous ne sommes pas dans une logique de domination. Il ne s’agit pas qu’un pays pompe sur un autre. Nous voulons des coopérations mutuellement gagnantes », a insisté Sonko.
Et de conclure : « Le vrai enjeu, c’est de rapprocher nos peuples. La coopération économique ne peut être durable que si elle s’appuie sur un socle humain et culturel solide. »",https://senego.com/sonko-plaide-pour-une-cooperation-gagnant-gagnant-entre-le-senegal-et-le-congo_1847879.html
Senego,People,Découverte troublante à Darou Rahmane : un corps retrouvé avec un poème de Serigne Touba,"12 juin 2025, 13:40",2025-06-12,Faty BA,"Ce matin, aux alentours de 10 heures, une découverte tragique a eu lieu à Darou Rahmane, une localité de Touba. Le corps d’un homme a été trouvé dans un bassin, dans un état de putréfaction avancé, rendant impossible son identification immédiate. Les premiers éléments de l’enquête indiquent que la mort serait survenue il y a au moins une semaine.
Face à cette situation alarmante, les autorités locales ont rapidement décidé l’inhumation du corps le jour même. Cependant, un élément intriguant a été découvert sur le défunt : un poème de Serigne Touba se trouvait dans ses vêtements. Ce détail ajoute encore aux mystères entourant ce décès.
Une enquête est actuellement en cours pour tenter de clarifier les circonstances entourant cette mort. Nos confrères de Kawtef ont relayé ces faits troublants, et nous suivons attentivement le développement de cette affaire énigmatique.",https://senego.com/decouverte-troublante-a-darou-rahmane-un-corps-retrouve-avec-un-poeme-de-serigne-touba_1847820.html
Senego,Politique,"Gladima accusée, le témoin clé rassure : « Pas de panique, les 73 millions mis dans un coffre-fort »","12 juin 2025, 10:31",2025-06-12,Mangoné KA,"Dans lâ€™affaire qui secoue lâ€™ancienne ministre des Mines, Sophie Gladima, le dÃ©cor frÃ´le lâ€™absurde : un centre de gravimÃ©trie jamais sorti de terre, un terrain introuvable, mais un tÃ©moin imperturbable. Ibrahima Issa, entrepreneur en premiÃ¨re ligne, assure quâ€™il a Â« planquÃ© Â» les 73 millions restants Ã  la Caisse des DÃ©pÃ´ts. Selon lui, les fonds dorment bien, au frais. Gladima, de son cÃ´tÃ©, clame son innocence…
Dans le dossier visant AÃ¯ssatou Sophie Gladima, ancienne ministre des Mines, le premier Ã  Ãªtre entendu en qualitÃ© de tÃ©moin a Ã©tÃ© le SÃ©nÃ©galo-libanais Ibrahima Issa.
Dans le cadre de lâ€™enquÃªte visant lâ€™ex-ministre des Mines, Sophie Gladima, la Haute Cour de justice a entendu le premier tÃ©moin, Ibrahima Issa, entrepreneur chargÃ© du Centre de gravimÃ©trie de KÃ©dougou.
Il affirme avoir rÃ©alisÃ© 75 % du chantier, Ã©valuÃ© Ã  193 millions de FCFA, et avoir dÃ©posÃ© les 73 millions restants Ã  la Caisse des dÃ©pÃ´ts, faute de terrain pour achever les travaux.
Il prÃ©cise nâ€™avoir jamais eu de contact direct avec Gladima, traitant uniquement avec le Dage du ministÃ¨re. De son cÃ´tÃ©, lâ€™ancienne ministre rejette toute accusation de dÃ©tournement, Ã©voquant une procÃ©dure budgÃ©taire classique et des blocages administratifs locaux pour expliquer les retards.
Son avocat dÃ©nonce un dossier Â« vide Â» et annonce une demande de libertÃ© provisoire, ainsi quâ€™un recours pour obtenir un non-lieu.",https://senego.com/gladima-accusee-le-temoin-cle-rassure-pas-de-panique-les-73-millions-mis-dans-un-coffre-fort_1847729.html
Senego,Politique,"Presse du Jour : Diakhaté en prison, Farba Ngom débouté, Sophie Gladima auditionnée (Senego TV)","12 juin 2025, 12:26",2025-06-12,Mangoné KA,"La presse du jour met en lumière les enjeux de la tournée économique du Président Diomaye Faye dans la région de Saint-Louis, où paysans et industriels nourrissent de fortes attentes.
Sur le plan judiciaire, l’attention se porte sur plusieurs dossiers brûlants : Moustapha Diakhaté a été incarcéré, la demande de liberté provisoire de Farba Ngom, gravement malade, a été rejetée, tandis que Sophie Gladima est toujours auditionnée sur le fond de son affaire.
Par ailleurs, certains médias réclament la suppression de l’article 80, qui sanctionne l’offense au chef de l’État.
Dans le même temps, la tuberculose s’est dangereusement propagée à Pikine-Guédiawaye, avec plus de 500 cas dépistés..",https://senego.com/presse-du-jour-diakhate-en-prison-farba-ngom-deboute-sophie-gladima-auditionnee-senego-tv_1847782.html
Senego,Sport,L’affaire Ama Baldé prend une autre ampleur : La police de l’air et des frontières aux trousses de la famille Baldé,"12 juin 2025, 08:29",2025-06-12,Mandaw Mbengue,"Le célèbre lutteur Ama Baldé, son frère Pathé Baldé, et leur neveu surnommé « Julo », sont désormais dans le viseur de la justice. Tous trois sont activement recherchés par la Police de l’air et des frontières (PAF), après une altercation tendue avec les forces de l’ordre.
Les faits remontent à une tentative d’interpellation de « Julo », accusé d’agression et de vol de moto. Ama et Pathé Baldé se seraient opposés avec véhémence à cette arrestation, allant jusqu’à provoquer une confrontation physique avec un adjudant de police. Profitant de la confusion, le jeune suspect a réussi à prendre la fuite.
Une perquisition menée peu après dans la chambre de Julo a abouti à la saisie de 14 cornets de chanvre indien et d’une paire de ciseaux. Mais entre-temps, les frères Baldé avaient disparu, échappant aux policiers mobilisés pour l’opération.
Le parquet de Pikine-Guédiawaye a été immédiatement saisi. Une procédure a été enclenchée pour permettre l’arrestation des trois hommes dès qu’ils franchiront les frontières nationales. L’affaire prend une tournure judiciaire sérieuse, et la cavale du trio ne semble être qu’une question de temps.",https://senego.com/laffaire-ama-balde-prend-une-autre-ampleur-la-police-de-lair-et-des-frontieres-aux-trousses-de-la-famille-balde_1847682.html
Senego,Politique,"Sonko : « La diplomatie commence par le voisinage immédiat, sortons du complexe de l’ailleurs »","12 juin 2025, 15:59",2025-06-12,Mangoné KA,"En marge de la visite d’amitié et de travail du Premier ministre de la République du Congo, Anatole Collinet Makosso, le chef du gouvernement sénégalais, Ousmane Sonko, a tenu un point de presse conjoint ce jeudi à Dakar. Une rencontre au cours de laquelle il a défendu une diplomatie recentrée sur le continent africain et les pays voisins.
« La diplomatie commence par le voisinage immédiat », a affirmé Ousmane Sonko, soulignant que le Sénégal compte réorienter ses priorités diplomatiques vers l’Afrique. Pour lui, cette vision n’est pas nouvelle, mais s’inscrit dans un engagement de longue date. « Ce sont des orientations assumées qui découlent d’un long parcours politique. Cela fait plus de dix ans que nous prônons cette approche dans nos discours, nos écrits et nos programmes », a-t-il rappelé.
Dans un ton critique, le Premier ministre sénégalais a dénoncé une forme d’aliénation héritée de la colonisation qui pousse les pays africains à se tourner instinctivement vers l’extérieur. « L’une des erreurs fondamentales de l’Afrique, c’est cette tendance à considérer qu’un acte diplomatique n’a de valeur que s’il est dirigé vers des puissances étrangères. Aller en visite chez un voisin africain est perçu comme moins prestigieux que se rendre dans un grand hôpital occidental ou asiatique », a-t-il regretté.
Insistant sur la nécessité de renforcer les échanges intra-africains, Sonko a pointé les limites d’une économie extravertie. « Le niveau des échanges entre pays africains est d’une faiblesse inquiétante. Résultat : tout devient plus cher. Nous exportons et importons des produits à des milliers de kilomètres alors que les matières premières viennent souvent d’Afrique même », a-t-il déploré.
Pour sortir de ce cycle, le chef du gouvernement sénégalais appelle à rompre avec les réflexes hérités et à assumer pleinement le potentiel africain. « Il faut casser ce cycle et sortir de ce complexe. Nous resterons bien entendu ouverts au monde, le président de la République a effectué plusieurs déplacements hors du continent, et moi-même je commencerai aussi bientôt à voyager. Mais chaque déplacement aura un objectif précis, tourné vers les intérêts du Sénégal », a-t-il conclu.",https://senego.com/sonko-la-diplomatie-commence-par-le-voisinage-immediat-sortons-du-complexe-de-lailleurs_1847859.html
SeneNews,Actualité,"L’« offense au chef de l’État », Le FRAPP condamne l’utilisation abusive de l’article 254",11/06/2025 à 23:00,2025-06-11 23:00,Kabir Sall,"C’est à travers un communiqué que le Front pour une révolution anti-impérialiste populaire et panafricaine (FRAPP) a critiqué violemment l’article 254 du code pénal, qu’il qualifie de « vestige colonial » tout en dénonçant l’usage récurrent de cet article, qui sert d’arme contre les citoyens.

Le FRAPP appelle à la révision immédiate de cet article, afin qu’il ne soit plus un instrument de répression politique.Ce changement est nécessaire pour sortir la parole politique du champ pénal et garantir un débat public libre, pluraliste et apaisé.Cette réforme permettrait de désamorcer les crispations judiciaires inutiles et de recentrer l’action judiciaire sur les véritables priorités nationales : la souveraineté, la justice sociale et la prospérité du pays.Le procureur de la République ne doit plus être le bras armé aveugle du pouvoir exécutif. Il a le devoir de garantir les droits fondamentaux, de respecter le pluralisme, et de protéger la République – pas d’intimider le peuple.Le FRAPP appelle le comité ad hoc de mise en œuvre des recommandations des Assises de la Justice à inscrire à la révision de l’article 254 dans l’agenda législatif prioritaire. C’est une mesure simple, juste et urgente, pour ouvrir enfin une ère de maturité démocratique.Le Secrétariat Exécutif National (SEN) du FRAPPLe 11 juin 2025

Cette réforme permettrait de désamorcer les crispations judiciaires inutiles et de recentrer l’action judiciaire sur les véritables priorités nationales : la souveraineté, la justice sociale et la prospérité du pays.Le procureur de la République ne doit plus être le bras armé aveugle du pouvoir exécutif. Il a le devoir de garantir les droits fondamentaux, de respecter le pluralisme, et de protéger la République – pas d’intimider le peuple.Le FRAPP appelle le comité ad hoc de mise en œuvre des recommandations des Assises de la Justice à inscrire à la révision de l’article 254 dans l’agenda législatif prioritaire. C’est une mesure simple, juste et urgente, pour ouvrir enfin une ère de maturité démocratique.Le Secrétariat Exécutif National (SEN) du FRAPPLe 11 juin 2025

Le procureur de la République ne doit plus être le bras armé aveugle du pouvoir exécutif. Il a le devoir de garantir les droits fondamentaux, de respecter le pluralisme, et de protéger la République – pas d’intimider le peuple.Le FRAPP appelle le comité ad hoc de mise en œuvre des recommandations des Assises de la Justice à inscrire à la révision de l’article 254 dans l’agenda législatif prioritaire. C’est une mesure simple, juste et urgente, pour ouvrir enfin une ère de maturité démocratique.Le Secrétariat Exécutif National (SEN) du FRAPPLe 11 juin 2025

Le FRAPP appelle le comité ad hoc de mise en œuvre des recommandations des Assises de la Justice à inscrire à la révision de l’article 254 dans l’agenda législatif prioritaire. C’est une mesure simple, juste et urgente, pour ouvrir enfin une ère de maturité démocratique.Le Secrétariat Exécutif National (SEN) du FRAPPLe 11 juin 2025

Le Secrétariat Exécutif National (SEN) du FRAPPLe 11 juin 2025",https://www.senenews.com/actualites/l-offense-au-chef-de-letat-le-frapp-condamne-lutilisation-abusive-de-larticle-254_545379.html
SeneNews,Actualité,Thiaroye- Sur-Mer : un quinquagénaire retrouvé sans vie dans sa salle de bain,11/06/2025 à 22:21,2025-06-11 22:21,Kabir Sall,"Une découverte macabre secoue la commune d’arrondissement de Thiaroye-sur-Mer depuis ce mardi 10 juin. M. Ba, un commerçant de profession, a été retrouvé mort à son domicile, dans sa salle de bain.

L’homme âgé d’une cinquantaine d’années n’avait plus donné signe de vie depuis samedi dernier, qui coïncidait avec le jour de la Tabaski. Une odeur nauséabonde qui provenait de sa chambre a alerté ses voisins de location.Ce sont les gendarmes de la brigade territoriale de Thiaroye qui ont défoncé la porte de M. BA, découvrant également son corps en état de putréfaction, rapporte Seneweb.Le rapport médical conclut à une mort naturelle, ajoute la source. Il a été inhumé avec l’avis favorable du procureur de la République.

Ce sont les gendarmes de la brigade territoriale de Thiaroye qui ont défoncé la porte de M. BA, découvrant également son corps en état de putréfaction, rapporte Seneweb.Le rapport médical conclut à une mort naturelle, ajoute la source. Il a été inhumé avec l’avis favorable du procureur de la République.

Le rapport médical conclut à une mort naturelle, ajoute la source. Il a été inhumé avec l’avis favorable du procureur de la République.",https://www.senenews.com/actualites/thiaroye-sur-mer-un-quinquagenaire-retrouve-sans-vie-dans-sa-salle-de-bain_545378.html
SeneNews,Politique,Thierno Alassane Sall questionne le ministre Birame Souleye Diop au sujet du coût du carburant à la pompe,11/06/2025 à 21:49,2025-06-11 21:49,Kabir Sall,"Le député Thierno Alassane Sall a adressé une question écrite au ministre des Énergies, du Pétrole et des Mines, Birame Souleye Diop, au sujet du prix du carburant à la pompe.

Le député semble interroger le ministre sur les raisons de cette stagnation des prix et sur les mesures envisagées pour les ajuster.",https://www.senenews.com/actualites/thierno-alassane-sall-questionne-le-ministre-birame-souleye-diop-au-sujet-du-cout-du-carburant-a-la-pompe_545370.html
SeneNews,Météo,Alerte – météo : l’Anacim annonce de la pluie dans plusieurs régions du pays,11/06/2025 à 21:22,2025-06-11 21:22,Kabir Sall,"L’hivernage s’approche et les premières pluies sont attendues dans plusieurs régions du pays selon les dernières prévisions de l’agence de l’Aviation civile et de la Météorologie (ANACIM).

Dans son bulletin de mercredi, l’ANACIM a publié un avis de pluie, pour la période du 11 au 14 juin 2025. Plusieurs régions, notamment le sud et l’est du Sénégal, sont concernées.Des orages et des pluies sont attendus à partir de cet après-midi, dans ces zones : Kédougou, Tambacounda, Matam, Ziguinchor, Sédhiou, Kolda.Le centre du Sénégal pourrait également connaitre des pluies : Kaffrine, Kaolack, Fatick, DiourbelLa région de Dakar et de Thiès, voire de Louga, pourrait être touchée !Risque de fortes pluies (jusqu’à 50 mm).L’agence de l’Aviation civile et de la Météorologie indique que des fortes pluies pouvant atteindre 50 mm pouvaient s’abattre à l’est la nuit du mercredi et dans le sud et le centre-sud entre jeudi et vendredi.

Des orages et des pluies sont attendus à partir de cet après-midi, dans ces zones : Kédougou, Tambacounda, Matam, Ziguinchor, Sédhiou, Kolda.Le centre du Sénégal pourrait également connaitre des pluies : Kaffrine, Kaolack, Fatick, DiourbelLa région de Dakar et de Thiès, voire de Louga, pourrait être touchée !Risque de fortes pluies (jusqu’à 50 mm).L’agence de l’Aviation civile et de la Météorologie indique que des fortes pluies pouvant atteindre 50 mm pouvaient s’abattre à l’est la nuit du mercredi et dans le sud et le centre-sud entre jeudi et vendredi.

Le centre du Sénégal pourrait également connaitre des pluies : Kaffrine, Kaolack, Fatick, DiourbelLa région de Dakar et de Thiès, voire de Louga, pourrait être touchée !Risque de fortes pluies (jusqu’à 50 mm).L’agence de l’Aviation civile et de la Météorologie indique que des fortes pluies pouvant atteindre 50 mm pouvaient s’abattre à l’est la nuit du mercredi et dans le sud et le centre-sud entre jeudi et vendredi.

La région de Dakar et de Thiès, voire de Louga, pourrait être touchée !Risque de fortes pluies (jusqu’à 50 mm).L’agence de l’Aviation civile et de la Météorologie indique que des fortes pluies pouvant atteindre 50 mm pouvaient s’abattre à l’est la nuit du mercredi et dans le sud et le centre-sud entre jeudi et vendredi.

Risque de fortes pluies (jusqu’à 50 mm).L’agence de l’Aviation civile et de la Météorologie indique que des fortes pluies pouvant atteindre 50 mm pouvaient s’abattre à l’est la nuit du mercredi et dans le sud et le centre-sud entre jeudi et vendredi.

L’agence de l’Aviation civile et de la Météorologie indique que des fortes pluies pouvant atteindre 50 mm pouvaient s’abattre à l’est la nuit du mercredi et dans le sud et le centre-sud entre jeudi et vendredi.",https://www.senenews.com/meteo/alerte-meteo-lanacim-annonce-de-la-pluie-dans-plusieurs-regions-du-pays_545368.html
