theme,titre,date,auteur,contenu
politique,Répression politique : le FRAPP dénonce l’usage abusif de l’article 254 et appelle à sa réforme…,"11 juin 2025, 22:23",Antoine Sarr,"À travers un communiqué, le Front pour une Révolution Anti-impérialiste Populaire et Panafricaine (FRAPP) s’en prend vigoureusement à l’article 254 du Code pénal, qu’il qualifie de « vestige colonial » utilisé pour museler les voix critiques.
L’organisation exige son retrait immédiat, dénonçant un usage répressif orchestré par le procureur pour bâillonner opposants, journalistes et activistes.
« Le Front pour une Révolution Anti-impérialiste Populaire et Panafricaine (FRAPP) dénonce l’usage récurrent de l’article 254 du Code pénal par les moyens énoncés dans l’article 248 pour réprimer la liberté d’expression. Hérité du système colonial, ce texte criminalise l’« offense au chef de l’État » et continue de servir d’arme contre les citoyens », lit-on dans un communiqué.
« Alors que le dialogue national a mis l’accent sur l’article 80 relatif à la sûreté de l’État, c’est bien l’article 254 qui alimente, au quotidien, la répression politique. Il est activé par le procureur à chaque moment de tension pour poursuivre journalistes, acteurs politiques, activistes ou chroniqueurs. Ce recours systématique traduit une volonté de museler la critique légitime et d’intimider les voix dissidentes », dénonce le Frapp.
Le FRAPP appelle à la révision immédiate de cet article, afin qu’il ne soit plus un instrument de répression politique.
D’après le Frapp, ce changement est nécessaire pour sortir la parole politique du champ pénal et garantir un débat public libre, pluraliste et apaisé.
« Cette réforme permettrait de désamorcer les crispations judiciaires inutiles et de recentrer l’action judiciaire sur les véritables priorités nationales : la souveraineté, la justice sociale et la prospérité du pays », poursuit le communiqué.
Pour le Secrétariat Exécutif National (SEN) du FRAPP, « le procureur de la République ne doit plus être le bras armé aveugle du pouvoir exécutif. Il a le devoir de garantir les droits fondamentaux, de respecter le pluralisme, et de protéger la République – pas d’intimider le peuple ».
Le FRAPP appelle le comité ad hoc de mise en œuvre des recommandations des Assises de la Justice à inscrire à la révision de l’article 254 dans l’agenda législatif prioritaire."
politique,Carburant trop cher : Thierno Alassane Sall exige des explications,"11 juin 2025, 22:12",Mouhamed DIOUF,"Le député Thierno Alassane Sall a adressé une question écrite au ministre des Énergies, du Pétrole et des Mines, pointant du doigt l’inaction de l’État face à la baisse du prix du baril de pétrole et du dollar sur les marchés internationaux. Selon lui, malgré un recul de 18 % du Brent et de plus de 5 % du taux de change USD/XOF entre juin 2024 et juin 2025, les prix du carburant à la pompe au Sénégal demeurent inchangés — et parmi les plus élevés de la sous-région.
Dans sa correspondance, le parlementaire souligne que des pays enclavés comme le Mali et le Niger, qui dépendent en partie du port de Dakar pour leur approvisionnement en hydrocarbures, affichent des prix à la pompe inférieurs à ceux du Sénégal. Un paradoxe, d’autant plus surprenant que le pays est désormais producteur de pétrole, grâce au champ offshore de Sangomar.
M. Sall déplore les effets économiques négatifs de cette situation, notamment sur le pouvoir d’achat des ménages, la compétitivité des entreprises locales et la viabilité de secteurs sensibles comme le transport, la pêche ou l’agriculture. Il s’interroge sur l’absence d’un mécanisme transparent de révision périodique des prix à la pompe, aligné sur les fluctuations internationales.
Le député demande des explications claires sur les critères internes qui justifient un tel écart tarifaire avec les pays voisins, ainsi que sur les mesures envisagées pour soulager les consommateurs sénégalais, sans mettre en péril les équilibres du secteur pétrolier national."
politique,Urgences hospitalières : Le PM Sonko veut « un visage plus humain » pour les soins d’urgence …,"11 juin 2025, 21:33",Antoine Sarr,"Lors du Conseil des ministres tenu ce mercredi 11 juin 2025, le Premier ministre Ousmane Sonko a mis en avant la nécessité d’améliorer significativement la gestion des urgences hospitalières au Sénégal.
Rappelant que le gouvernement accorde « une priorité élevée à l’accès des populations aux soins d’urgence de qualité », le chef du gouvernement a insisté sur la dimension humaine de la prise en charge. Il a ainsi appelé à « accorder une attention toute particulière à l’amélioration de la qualité des services d’accueil d’urgence afin de donner un visage plus humain à la prise en charge des personnes en détresse ».
Dans cette dynamique, Ousmane Sonko a invité le ministre de la Santé et de l’Action sociale à renforcer le dispositif du SAMU national. Il a également souligné la nécessité de « travailler en parfaite synergie avec la Brigade nationale des Sapeurs-pompiers et les autres structures publiques et privées évoluant dans le secteur »."
politique,Dérives sur les marchés publics: Ousmane Sonko exige une formation rigoureuse des acteurs,"11 juin 2025, 21:20",Mouhamed DIOUF,"Le Premier Ministre Ousmane Sonko a mis en garde contre les dérives constatées dans la gestion des marchés publics, lors du Conseil des ministres tenu ce mercredi. Il a dénoncé les pratiques de surfacturation et les violations graves des règles de passation des marchés, relevées lors de la relecture de plusieurs contrats et conventions conclus par l’État.
Face à cette situation préoccupante, le chef du gouvernement a insisté sur la nécessité d’une formation complète à toutes les étapes de la commande publique. Il souhaite que chaque acteur impliqué dispose des compétences requises pour garantir une gestion rigoureuse, efficace et transparente. Il a aussi exigé la mise en place d’un dispositif de suivi-évaluation pour mesurer l’impact de ces formations sur le terrain.
Dans cette perspective, Ousmane Sonko a instruit le Ministre Secrétaire général du Gouvernement de proposer, en collaboration avec la DCMP et l’ARCOP, des termes de référence pour un programme de formation pertinent, en tenant compte des besoins réels des parties prenantes. Cette initiative vise à instaurer une culture de conformité dans l’exécution des marchés publics.
Enfin, le Premier Ministre a demandé au Ministre des Finances et du Budget de mobiliser les ressources financières nécessaires à la mise en œuvre de cette formation. Il a précisé que le respect des règles de la commande publique sera désormais un critère de performance pour toutes les entités et gestionnaires publics."
politique,Conférence sur la Palestine et sommet de la CEDEAO : Le président Diomaye Faye attendu à New York et Abuja…,"11 juin 2025, 20:47",Antoine Sarr,"Le Président de la République, Bassirou Diomaye Faye, intensifie son engagement sur la scène internationale.
Lors du Conseil des ministres tenu ce mercredi 11 juin 2025, le chef de l’État, Bassirou Diomaye Faye a annoncé sa participation à deux importants événements diplomatiques.
Du 17 au 19 juin, le chef de l’État prendra part à la Conférence sur la Palestine, prévue à New York. Cette rencontre s’inscrit dans un contexte international tendu et vise à renforcer les efforts en faveur d’une paix durable et juste au Moyen-Orient, une cause à laquelle le Sénégal reste particulièrement attaché.
Dans la continuité de cette dynamique diplomatique, Bassirou Diomaye Faye se rendra ensuite à Abuja, au Nigeria, où il participera le 22 juin au Sommet des chefs d’État de la CEDEAO."
politique,L’essentiel du communiqué du conseil des ministres du mercredi 11 juin 2025,"11 juin 2025, 20:45",Abdou Faty GUEYE,"Ce mercredi 11 juin, le Président de la République a présidé son habituel Conseil des ministres. Au menu des discussions, Bassirou Diomaye Faye a focalisé son intervention sur 6 points centraux. Les voici.
1-Rencontre nationale annuelle avec les religieux
Après avoir réaffirmé sa satisfaction liée à la fête de la Tabaski et la 137ème édition du Pèlerinage marial de Popenguine, le Président de la République a mis l’accent sur l’importance de la religion au Sénégal. Il a d’ailleurs informé le gouvernement de sa volonté de tenir chaque année une rencontre nationale avec les Guides religieux et Chefs coutumiers.
Ensuite, Bassirou Diomaye Faye, citant l’exemplarité du dialogue interreligieux au Sénégal, demandant par ailleurs aux ministres de « mobiliser les moyens adéquats en vue d’accompagner au mieux la modernisation des sites religieux ainsi que l’exercice du culte sur l’étendue du territoire national ».
2-Campagnes agricole
Concernant la campagne agricole, Bassirou Diomaye Faye a insisté sur la préparation et l’intensification des efforts de promotion de la souveraineté alimentaire du Sénégal, qui constitue une priorité du gouvernement. À cet égard, saluant toutes les mesures prises jusqu’ici, il « a demandé au Gouvernement, notamment au Ministre en charge de l’Agriculture et au Ministre en charge des Finances, d’accélérer les modalités de mise à disposition des semences, engrais et matériels agricoles sur l’étendue du territoire national ».
Par ailleurs, sachant que la pluviométrie connait une accélération dans plusieurs zones géographiques du Sénégal, le Chef de l’Etat a demandé au gouvernement, en particulier le ministre de l’Agriculture et celui des Finances, d’accélérer les modalités de mise à disposition des semences, engrais et matériels agricoles sur l’étendue du territoire national. de plus, il souhaite que les coopératives agricoles communautaires soient renforcées et mieux impliquées dans le processus de mise en place du dispositif relatif à la campagne de production agricole.
3-Formation professionnelle dans els métiers de l’agriculture
En outre, le Président de la République a insisté sur le besoin urgent de « les formations professionnelles liées aux métiers agricoles et d’envisager le renforcement des lycées agricoles ou des centres de formation aux métiers de l’agriculture à l’image de l’Ecole nationale supérieure d’Agriculture, socle de la formation d’ingénieurs agricoles ». Il veut également que le ministre de l’Agriculture, de la Souveraineté alimentaire et de l’Elevage puisse développer un programme spécial de renforcement des aménagements agricoles et d’actualiser les lettres de mission de la Société nationale d’Aménagement et d’Exploitation des terres du Delta du fleuve Sénégal et des vallées du fleuve Sénégal et de la Falémé (SAED), de la Société de Développement agricole et industriel du Sénégal (SODAGRI) et de la Société de Développement et des Fibres textiles (SODEFITEX). Tout cela permettra de mieux planifier les productions rizicoles, céréalières, cotonnières ainsi que les spéculations à haute valeur en termes de commercialisation et de consommation.
Puis, le Chef de l’Etat invite le gouvernement à fournir encore plus d’efforts dans la relance et l’extension des Domaines agricoles communautaires, mais aussi des Agropoles qui doivent subir un suivi concernant leur implémentation effective dans les sites dédiés, ce dans le cadre du monitoring de l’Agenda national de Transformation. Dans le même ordre d’idées, « Le Chef de l’Etat a, dans le même sillage, invité le Gouvernement à accentuer l’implication et la mobilisation des jeunes dans le développement de l’agriculture et la promotion de la souveraineté alimentaire ». Dans ce sillage, il souhaite que le gouvernement, notamment le ministre de l’Agriculture, de la Souveraineté alimentaire et de l’Elevage, le  Ministre en charge de la Jeunesse et le Secrétaire d’Etat aux Coopératives et de l’Encadrement paysan, puissent prendre toutes les dispositions pour une bonne organisation, à Dakar, du 30 août au 05 septembre 2025, de la 19ème édition du Forum africain des systèmes alimentaires sous le thème « Jeunesse africaine : fer de lance de la collaboration, de l’innovation et de la transformation des systèmes alimentaires.
Et, pour mieux soutenir la transformation durable du système agricole national, Bassirou Diomaye Faye sera à Saint-Louis les 12 et 13 juin afin de mener une visite économique et de travail dans la région. Enfin, le 10 juin 2025, il présidera le Conseil supérieur d’orientation agrosylvopastoral.
4-Politique maritime
La politique maritime du Sénégal est au cœur des préoccupations du Président de la République. Et, sachant que le pays possède 700 kilomètres de côtes ouvertes sur l’océan Atlantique, gage d’un gros potentiel maritime, le Chef de l’Etat a rappelé que la finalisation de la nouvelle politique maritime était une urgence et qu’elle devait impérativement impliquer l’ensemble des acteurs publics, privés et les populations des zones concernées. Ainsi, il a demandé que le Premier ministre accentue le suivi de toutes les infrastructures maritimes et portuaires en service, en cours de réalisation ou en projet avec des partenaires bien identifiés. Il veut également qu’il supervise la mise en œuvre de la stratégie de promotion de l’attractivité et de la compétitivité des ports publics et privés du Sénégal, et qu’il définisse également un cadre renforcé d’évaluation des performances des infrastructures maritimes et portuaires nationales.
Bassirou Diomaye Faye a aussi « souligné l’impératif de renforcer le dispositif de coordination de l’action de l’Etat en mer avec la réalisation urgente d’infrastructures spécialisées sous le contrôle de la Haute Autorité chargée de la Coordination de la Sécurité maritime, de la Sûreté et de la Protection de l’Environnement marin (HASSMAR) ».
Par ailleurs, Le Président de la République a demandé au Gouvernement de « poursuivre les concertations régulières avec les acteurs de la pêche artisanale et ceux de la pêche industrielle ainsi que les scientifiques et chercheurs, en vue d’une maitrise stratégique des zones de pêche, de nos ressources halieutiques et fonds marins, dans le respect des lois et règlements et des conventions internationales en la matière. »
5-Tourisme
Pour ce qui est du secteur touristique, moteur de la relance économique du pays et de la création d’emplois dans les sites et zones dédiés, le Chef de l’Etat a demandé au ministre de tutelle l’actualisation des programmes d’aménagement de nouvelles zones touristiques afin de mener à la relance du secteur avec l’implication sous la supervision du Premier ministre Ousmane Sonko.
Pour le Président, il y a également une urgence quant à la tenue d’une réunion interministérielle sur le tourisme pour mettre au gouvernement de mieux mettre en œuvre l’agenda de développement du secteur.
6-Nations-Unies et CEDEAO
Pour clôturer ce Conseil, Bassirou Diomaye Faye a évoqué son agenda diplomatique des prochaines semaines. Le Président de la République a ainsi « informé le Conseil qu’il participera, du 17 au 19 juin 2025 à New York, à la Conférence sur la Palestine et prendra part, le 22 juin 2025 à Abuja, au Sommet de la CEDEAO ».
LESOLEIL.SN"
